{
  "schemaVersion": "vending-vision-site-config/v1",
  "host": "127.0.0.1",
  "port": 7892,
  "allowed_origins": [
    "http://127.0.0.1:7892",
    "http://localhost:7892",
    "http://tauri.localhost"
  ],
  "maintenance_capability_keyring_path": "C:\\ProgramData\\VEM\\vision\\daemon-maintenance-keys.json",
  "maintenance_session_path": "C:\\ProgramData\\VEM\\vision\\daemon-maintenance-session.json",
  "maintenance_replay_path": "C:\\ProgramData\\VEM\\vision\\camera-maintenance-replay.json",
  "cameras": {
    "top": {
      "backend": "dshow",
      "width": 1280,
      "height": 720,
      "fps": 30,
      "fourcc": "MJPG",
      "role": "presence",
      "keep_open": true,
      "rotate": 0
    },
    "front": {
      "backend": "dshow",
      "width": 1280,
      "height": 720,
      "fps": 30,
      "fourcc": "MJPG",
      "role": "profile_tryon",
      "keep_open": true,
      "rotate": 270
    }
  }
}
